{"citation_id":"cit-fictional-001","grounded_answer_id":"ans-fictional-001","claim_id":"clm-fictional-001","context_id":"ctx-fictional-001","checked_at":"2026-08-13T00:00:02Z","validation_status":"VALID","document_id":"doc-fictional-001","version_id":"ver-fictional-001","chunk_ids":["chk-fictional-001"],"canonical_source":{"official_title":"Văn bản hư cấu dùng kiểm thử","document_number":"VB-TEST-001","canonical_url":"https://example.invalid/legal/doc-fictional-001","locator":{"page":1},"excerpt":"Đoạn trích hư cấu chỉ dành cho kiểm thử.","render_hash":"sha256:render-fictional-0001"}}
